麦田,30,0,始终不痛不痒，我看到的，是一个努力的王宝强
mighty 4 dog,30,0,一点也不好笑
小维,30,0,怎么说呢？没有《人在囧途》的灵气了，囧1是在反应春运，而泰囧的背景太弱了。。。
King Sitcome,10,2,人家烂脚后跟的玩意儿，咱都能拿来赚钱。徐铮想玩儿烂仔帮路线？嚼着预产期和宿醉渣滓，还觉得津津有味？什么时候该尝试英式喜剧了呢？中国人是不长于幽默的——也就是缺乏创造力和想象力。看完这片子并且没乐，我是多么的有优越感啊！呵呵~！
Fallcon,30,0,没有想象中的好  也没怎么笑  情节也还是有点做作  我其实挺奇怪的 这样一部电影 怎么就被炒的这么火   第一：演员  第二：宣传  第三：适当的切入点  总之 国产电影 加油！
中天野部慧,30,0,说好看的人 笑点在哪里啊？
喵公子,30,0,没有人在囧途好看，也可能是预期拉得太高，现实反倒显得失望。黄渤一如既往，好，可是也没什么惊艳爆点。
软蛋黄,40,0,上映了一个多月我才进影院观看，很久没有看国产电影笑了。惊喜的国产贺岁，故事简单，但是段子出彩，作商业电影的，这样就够了。
JA5ON™,30,0,额。失望大于期望，豆瓣评分虚高啊，明显不如第一部好看，不过这个梦幻组合还是挺开心，王勃戏点占得不够多，不够出彩，傻根还是一如既往地最亮眼。
Jason H.Chin,30,3,这片评到8.3分，徐铮老师该是花了多少钱雇水军啊！
丝绒陨,30,2,也不赖吧，能给到3.5+
pixiedust,30,0,回味了一下去年的清迈行
WAKEUPSTUPID,20,0,"据说全国人民都笑尿崩了,无........聊........."
一灯,30,0,要是再多一分钟都会让人觉得很烦，一堆碎片和胡闹，虽然其中有一点点反思和很多的接地气
Simon Louis,40,0,王宝强那扮相，我勒个去。国产喜剧拍成这样差不多了。不过当初豆瓣那个8.4分，哎，不解释啦。
樊guan,50,0,能让我看完。
JA5ON™,30,0,额。失望大于期望，豆瓣评分虚高啊，明显不如第一部好看，不过这个梦幻组合还是挺开心，王勃戏点占得不够多，不够出彩，傻根还是一如既往地最亮眼。
Jason H.Chin,30,3,这片评到8.3分，徐铮老师该是花了多少钱雇水军啊！
丝绒陨,30,2,也不赖吧，能给到3.5+
pixiedust,30,0,回味了一下去年的清迈行
WAKEUPSTUPID,20,0,"据说全国人民都笑尿崩了,无........聊........."
一灯,30,0,要是再多一分钟都会让人觉得很烦，一堆碎片和胡闹，虽然其中有一点点反思和很多的接地气
Simon Louis,40,0,王宝强那扮相，我勒个去。国产喜剧拍成这样差不多了。不过当初豆瓣那个8.4分，哎，不解释啦。
樊guan,50,0,能让我看完。
康哥,40,0,PG13版的宿醉，徐铮活脱脱一个国产史蒂夫卡莱尔
阿闪,40,0,三傻大闹清迈。笑点泪点都戳的很准，感觉是去做马杀鸡的。
青年哪吒,30,0,第一部更接地气，这个细节有点囧。不过看到结尾范冰冰出场，开始玩了，是个好现象。
孴腍胾嚉雬,30,0,配合B站弹幕看还比较欢乐。比囧途1好
小九儿,40,0,除了实在不喜欢王，其他都很好
折耳大猫,40,0,很搞笑，但没有宣传的那么牛
mr.tall,30,0,一般吧，及格
過期貓糧,30,2,一开始气氛炒得不错，但从头到尾完全靠用力表演来制造笑果，实在太用力了，尤其王宝强的装疯卖傻让我觉得疲惫和烦躁，一直看表心想怎么还没完。本来也没太多期待，票也不贵，也就陪爸妈看个热闹。
吃彩虹拉蝴蝶,30,0,这个片子我决定帮我妈pass掉了
Jo,40,0,萨瓦迪卡
我无解了怎么办,30,0,可能是期待过高了？？？
😮😮😮,50,0,看海报就知道，其实，徐朗是真人生赢家！
折耳大猫,40,0,很搞笑，但没有宣传的那么牛
mr.tall,30,0,一般吧，及格
過期貓糧,30,2,一开始气氛炒得不错，但从头到尾完全靠用力表演来制造笑果，实在太用力了，尤其王宝强的装疯卖傻让我觉得疲惫和烦躁，一直看表心想怎么还没完。本来也没太多期待，票也不贵，也就陪爸妈看个热闹。
吃彩虹拉蝴蝶,30,0,这个片子我决定帮我妈pass掉了
Jo,40,0,萨瓦迪卡
我无解了怎么办,30,0,可能是期待过高了？？？
😮😮😮,50,0,看海报就知道，其实，徐朗是真人生赢家！
TINTIN,40,2,虽说有些笑料制造的有点刻意，但在贺岁档里应该算是轻松好看的了。这么拍下去可以像《宿醉》那样成系列了。。。另外最后的惊喜确实让观众反应很热烈。
断桥漫个步,30,1,作为国产喜剧片 低俗被说成接地气 并不是什么好事吧。。
比芭宝,30,1,水军太多，打分虚高得吓人。
Lucifer@CCC,30,0,还行
EVANGELION,40,0,不觉得比第一部好。思想，笑料都没有达到巅峰水平，跟疯狂的石头比也差一个档次。牛逼的喜剧，全片没有突出笑点，但是让你一直保持激昂的状态，而泰囧则必须依靠铺垫制造笑点。
人体薄荷,comment-time,0,怎么场景一变成泰国就象电影了
庄常飞,30,0,如果之前没看票房火爆和某朋友泪流满面，那么会是四星，咕咕！
葵花卷,40,0,是挺喜感啦我旁边的人都笑成SB了，不过我感觉7.8分就刚刚好了。
腌笃鲜,40,6,景色很美，还是徐峥和王宝强鸡飞狗跳的囧途~虽然没有第一部口碑好但仍能在众多国产烂片中独树一帜。
Roman T,40,28,"第一部＜人在囧途＞的小打小闹,到了这里变成了华丽的冒险.可以看出来徐峥导演处女作的用心程度,节奏紧凑,笑点密集.连番倒霉后顿悟的人生道理,也足够动人.三大喜剧演员的倾情演绎很够味儿,这才是贺岁喜剧应该有的样子,值得一看〜最近的银幕,除了苦难历史,就是心灵哲思,该乐乐了.三星半"
Nobervem,40,0,有些材料元素谁都能有，要怎么组合表现却各自不同。
束,30,0,制作精良很搞笑。
弥赛亚代言人,30,0,简单又纯粹的喜剧小品，目标明确野心适度，在一众贺岁“大”片里脱颖而出倒不算让人意外，可惜影片远远说不上完美，整个后半段基本就混乱了，与前半部分王宝强的爆笑演出不同，后半部完全是用段子使劲格机观众。这片子受好评意料之中，但十亿票房，说到底还是天朝人民的从众心理太强烈了吧。
腌笃鲜,40,6,景色很美，还是徐峥和王宝强鸡飞狗跳的囧途~虽然没有第一部口碑好但仍能在众多国产烂片中独树一帜。
Roman T,40,28,"第一部＜人在囧途＞的小打小闹,到了这里变成了华丽的冒险.可以看出来徐峥导演处女作的用心程度,节奏紧凑,笑点密集.连番倒霉后顿悟的人生道理,也足够动人.三大喜剧演员的倾情演绎很够味儿,这才是贺岁喜剧应该有的样子,值得一看〜最近的银幕,除了苦难历史,就是心灵哲思,该乐乐了.三星半"
Nobervem,40,0,有些材料元素谁都能有，要怎么组合表现却各自不同。
束,30,0,制作精良很搞笑。
弥赛亚代言人,30,0,简单又纯粹的喜剧小品，目标明确野心适度，在一众贺岁“大”片里脱颖而出倒不算让人意外，可惜影片远远说不上完美，整个后半段基本就混乱了，与前半部分王宝强的爆笑演出不同，后半部完全是用段子使劲格机观众。这片子受好评意料之中，但十亿票房，说到底还是天朝人民的从众心理太强烈了吧。
藿香正气,40,0,失望。
沙老怪,40,3,三颗星给电影，一颗星给它对中国电影的贡献
MegaMind,40,0,我以为范冰冰是彩蛋了，没想到散了场还有更大的彩蛋！
光年‖影视歌三栖民工,30,0,是我笑点太高还是周围朋友笑点太低？支撑情节发展的是王宝强这种制造冲突的傻逼存在。一个傻逼i片而已，看完删
空思,30,0,过节图个乐呵，说实话搞笑程度上还不如第一部的小打小闹。
宫廷阉割师大人,30,0,要是徐铮没把“西游记”三个字说出来 就给四星 包袱抖得太干净其实也没意思 不过结尾的范冰冰真乃一大亮点啊……有几段还是挺搞笑的 感觉黄渤的角色没有让他发挥 配乐不错 基情有点太过了 特别是毒舌咬屁股然后帮吸那段……别的也就没啥可说的
Charlie 9,40,0,很应景，真心乐了，足矣~ 这钱花的多开心那，哈哈哈~
yada,40,0,很不错的片子啊，诶了个推荐，后面的煽情太煽情了，但是它不就是部喜剧片么?能让人哈哈大笑就成！还有，这个3000万投资的票房回报太屌了！还有还有！范爷威武霸气，不敢直视，BGM太欢乐了！！
kindsos,30,0,果然还行。我笑了好几次。
无所谓,10,0,"Dumb, full of clichés and predictable. Far inferior to 人在囧途。It took me 4 days to finish it, I found it that annoying."
ingrid,30,0,我不覺得怎麼樣啊
丐后,50,0,【牛】反正我笑得一直在飙泪^.^
江小豆,30,1,贺岁喜剧 不谈别的 笑了就成了呗 算有诚意 不过现在的电影 不管啥风格 没有不搞点基的 这是神马趋势 8.7分  这豆瓣分高的也有点过
箜,50,4,光线影业大器晚成厚积薄发力挽狂澜翻云覆雨之逆袭神作。
Dora KID.,40,0,诚意十足。
